{"operation_id":"monitor-public-example","operation_type":"monitor","purpose":"Future approved observation","input":{"notification":null},"permitted_domains":["careers.example.com"],"excluded_domains":[],"geography":{"country":"US"},"result_limit":5,"path_limits":["/jobs"],"max_depth":1,"page_limit":10,"only_main_content":true,"output_formats":["markdown"],"structured_schema_reference":"references/JOB_RECORD.schema.json","requires_authentication":true,"requires_human_approval":true,"external_write":false,"recurring":true,"enabled":false,"estimated_credit_category":"unknown","safety_notes":["inactive until separate human approval"],"command_preview":["firecrawl","monitor","--input-json","<approved-input>"],"status":"planned"}
